[
  {
    "wcaID": "2018LUOW01",
    "nickname": "比格",
    "amount": 100,
    "avatar": ""
  },
  {
    "wcaID": "2018SHEN07",
    "nickname": "乌龟圆子",
    "amount": 100,
    "avatar": ""
  },
  {
    "wcaID": "2017LIJI24",
    "nickname": "李嘉忆",
    "amount": 50,
    "avatar": ""
  },
  {
    "wcaID": "-",
    "nickname": "过桥",
    "amount": 6.66,
    "avatar": ""
  }
]
